{
  "id": "task_011",
  "type": "analysis_task",
  "goal": "基于 Cover Decision + Generation System 的最终目标，生成 20个历史封面反推分析表 V2：Decision + Generation 双层结构，用于校准封面决策、GPT image2 生成策略和自动质检规则。",
  "input": {
    "files": [],
    "text": "我们正在构建视频封面自动决策与生成系统。最终目标不是只推荐封面方案，而是输入视频后自动选帧、定标题、定布局、生成 GPT image2 prompt、调用 GPT image2 生成 Top 3 封面，并自动质检。当前 Step 1 是反推20个历史封面。分析表需要同时覆盖 Decision 层和 Generation 层。Decision 层用于判断封面为什么有效，Generation 层用于判断未来系统如何自动生成同类封面。"
  },
  "constraints": {
    "language": "zh-CN",
    "output_format": "markdown + json",
    "dependencies": "不需要额外依赖",
    "must_include": [
      "系统目标重新定义",
      "Step 1任务目标",
      "20封面反推分析表V2字段",
      "Decision层字段",
      "Generation层字段",
      "QA质检字段",
      "每个字段的解释",
      "每个字段的评分标准",
      "适合Excel使用的表格schema",
      "适合JSON使用的数据schema",
      "20个历史封面逐张分析提示词",
      "爆款规律提炼框架",
      "Frame Scoring权重V1",
      "Generation Prompt策略V1",
      "Image Quality Check规则V1",
      "后续Codex接入GPT image2的模块建议"
    ]
  },
  "expected_outputs": [
    "outputs/task_011/result.md",
    "outputs/task_011/result.json"
  ],
  "status": "pending"
}
